{
  "schema_version": "unreal-static-mesh-profile@3.0.0",
  "profile_id": "demo-desktop-balanced-v3",
  "profile_version": "3.0.0",
  "description": "演示用桌面交付规则：包含材质赋值和纹理依赖预算。数值为模拟项目数据。",
  "rules": {
    "triangle_budget": { "enabled": true, "max_lod0": 2000, "severity": "error" },
    "vertex_budget": { "enabled": true, "max_lod0": 1500, "severity": "error" },
    "material_slots": { "enabled": true, "max_count": 2, "severity": "warning" },
    "lod_count": { "enabled": true, "min_count": 1, "severity": "warning" },
    "nanite": { "enabled": true, "expected": "any", "severity": "warning" },
    "simple_collision": { "enabled": true, "min_primitive_count": 1, "allow_complex_as_simple": true, "severity": "warning" },
    "lightmap_uv": { "enabled": true, "required": true, "min_uv_channel_count": 2, "severity": "warning" },
    "lightmap_resolution": { "enabled": true, "min_resolution": 32, "severity": "info" },
    "object_name": { "enabled": true, "required_prefixes": ["SM_UABA_"], "pattern": "^SM_UABA_[0-9]{2}_[A-Za-z0-9_]+$", "severity": "warning" },
    "package_path": { "enabled": true, "allowed_roots": ["/Game/UABADemo"], "forbidden_segments": ["Developers", "Temp"], "severity": "warning" },
    "missing_materials": { "enabled": true, "max_missing_slots": 0, "severity": "error" },
    "unique_materials": { "enabled": true, "max_count": 2, "severity": "warning" },
    "texture_dependencies": { "enabled": true, "max_count": 8, "severity": "warning" },
    "texture_dimension": { "enabled": true, "max_size": 2048, "severity": "warning" }
  }
}
